{
  "schemaVersion": "v1",
  "runId": "p33-1",
  "replayRequestId": "R000029",
  "hopPath": "0",
  "sessionId": "S006",
  "stack": "legacy",
  "service": "order",
  "origin": "http",
  "version": "legacy",
  "request": {
    "method": "POST",
    "path": "/api/orders/ok-R000027/pay",
    "query": "",
    "headers": {
      "x-replay-request-id": "R000029",
      "x-run-id": "p33-1",
      "x-session-id": "S006",
      "x-replay-hop-path": "0",
      "idempotency-key": "idem-R000029"
    },
    "bodyHash": "sha256:e3b0c44298fc1c149afbf4c8996fb92427ae41e4649b934ca495991b7852b855"
  },
  "response": {
    "status": 200,
    "headers": {
      "content-type": "application/json"
    },
    "bodyHash": "sha256:dc19296cc1508deba1f6031848c0e656a8b74a92fd4ddb446b01400bdd8dbefb",
    "body": "{\"id\":4,\"orderKey\":\"ok-R000027\",\"items\":[{\"sku\":\"D-1\",\"qty\":2,\"price\":5000}],\"amount\":7000,\"couponKey\":\"ck-R000026\",\"discountAmount\":3000,\"status\":\"PAID\",\"transactionId\":\"tx-idem-R000029\",\"createdAt\":\"2026-09-01T00:00:00Z\"}"
  },
  "event": null,
  "dbAccess": {
    "statements": [
      {
        "seq": 1,
        "sql": "select o1_0.id,o1_0.amount,o1_0.coupon_key,o1_0.created_at,o1_0.discount_amount,o1_0.idempotency_key,o1_0.order_key,o1_0.status,o1_0.transaction_id from orders o1_0 where o1_0.order_key=?"
      },
      {
        "seq": 3,
        "sql": "select i1_0.order_id,i1_0.id,i1_0.line_no,i1_0.price,i1_0.qty,i1_0.sku from order_items i1_0 where i1_0.order_id=? order by i1_0.line_no"
      },
      {
        "seq": 5,
        "sql": "update orders set amount=?,coupon_key=?,created_at=?,discount_amount=?,idempotency_key=?,order_key=?,status=?,transaction_id=? where id=?"
      }
    ],
    "truncated": false
  },
  "externalCalls": [
    {
      "seq": 2,
      "method": "POST",
      "host": "wiremock",
      "path": "/gateway/charge",
      "requestBodyHash": "sha256:9c8f75762be881c0a0781b87cd0e382f6f7fa9d51351e5035925371de715a33c",
      "status": 200,
      "responseBodyHash": "sha256:5b45367fee9c5ec928350f77ab384a08338c1d0ff9b8f70782ba9189d60cb8e3",
      "childHopPath": "0.h1"
    }
  ],
  "events": {
    "published": [
      {
        "seq": 6,
        "topic": "order.paid",
        "key": "ok-R000027",
        "payloadHash": "sha256:e4a7a2858707721eaa2feb2900e9a735e59c7c58ebe10eed67743213d147a72d",
        "payload": "{\"orderKey\":\"ok-R000027\",\"amount\":7000,\"couponKey\":\"ck-R000026\"}",
        "ack": "ok",
        "childHopPath": "0.e1"
      }
    ]
  },
  "transactions": [
    {
      "seq": 4,
      "name": "poc.order.OrderService.pay",
      "phase": "COMMIT_BEGIN",
      "outcome": null
    },
    {
      "seq": 7,
      "name": "poc.order.OrderService.pay",
      "phase": "COMPLETED",
      "outcome": "COMMITTED"
    }
  ],
  "callTree": {
    "nodes": [
      {
        "seq": 1,
        "depth": 0,
        "class": "poc.order.OrderController",
        "method": "pay",
        "threw": false
      },
      {
        "seq": 2,
        "depth": 1,
        "class": "poc.order.OrderService",
        "method": "pay",
        "threw": false
      },
      {
        "seq": 3,
        "depth": 2,
        "class": "poc.order.OrderRepository",
        "method": "findByOrderKey",
        "threw": false
      },
      {
        "seq": 4,
        "depth": 2,
        "class": "poc.order.PaymentGatewayClient",
        "method": "charge",
        "threw": false
      },
      {
        "seq": 5,
        "depth": 2,
        "class": "poc.order.OrderEventPublisher",
        "method": "onOrderPaid",
        "threw": false
      }
    ],
    "truncated": false
  },
  "error": null,
  "timing": {
    "arrivedAt": "2026-10-13T11:40:20.848530588Z",
    "completedAt": "2026-10-13T11:40:20.937757713Z",
    "arrivedNano": 16305340974679,
    "completedNano": 16305430203971
  },
  "capturedAt": "2026-10-13T11:40:20.939072505Z"
}